{
  "$schema": "https://schema.paradoc.dev/2026-10-02.json",
  "kind": "checklist",
  "name": "property-inspection",
  "version": "1.0.0",
  "title": "Property Inspection Checklist",
  "description": "Comprehensive move-in/move-out property condition inspection checklist",
  "items": [
    {
      "id": "ext-walls",
      "title": "Exterior Walls",
      "description": "Check for cracks, damage, or needed repairs",
      "status": {
        "kind": "boolean"
      }
    },
    {
      "id": "ext-windows",
      "title": "Windows (exterior)",
      "description": "Check seals, frames, and glass condition",
      "status": {
        "kind": "boolean"
      }
    },
    {
      "id": "ext-doors",
      "title": "Entry Doors",
      "description": "Check locks, hinges, and weatherstripping",
      "status": {
        "kind": "boolean"
      }
    },
    {
      "id": "ext-roof",
      "title": "Roof (visible)",
      "description": "Check for missing shingles or visible damage",
      "status": {
        "kind": "boolean"
      }
    },
    {
      "id": "ext-gutters",
      "title": "Gutters & Downspouts",
      "description": "Check for clogs and proper drainage",
      "status": {
        "kind": "boolean"
      }
    },
    {
      "id": "ext-landscaping",
      "title": "Landscaping",
      "description": "Lawn, plants, trees condition",
      "status": {
        "kind": "boolean"
      }
    },
    {
      "id": "int-walls",
      "title": "Walls",
      "description": "Check for holes, cracks, stains",
      "status": {
        "kind": "boolean"
      }
    },
    {
      "id": "int-ceilings",
      "title": "Ceilings",
      "description": "Check for water stains, cracks, peeling",
      "status": {
        "kind": "boolean"
      }
    },
    {
      "id": "int-floors",
      "title": "Floors",
      "description": "Check flooring condition throughout",
      "status": {
        "kind": "boolean"
      }
    },
    {
      "id": "int-doors",
      "title": "Interior Doors",
      "description": "Check operation, locks, handles",
      "status": {
        "kind": "boolean"
      }
    },
    {
      "id": "int-windows",
      "title": "Windows (interior)",
      "description": "Check locks, screens, operation",
      "status": {
        "kind": "boolean"
      }
    },
    {
      "id": "int-lighting",
      "title": "Light Fixtures",
      "description": "Check all fixtures and bulbs",
      "status": {
        "kind": "boolean"
      }
    },
    {
      "id": "kit-cabinets",
      "title": "Cabinets",
      "description": "Check doors, drawers, hinges",
      "status": {
        "kind": "boolean"
      }
    },
    {
      "id": "kit-countertops",
      "title": "Countertops",
      "description": "Check for chips, stains, damage",
      "status": {
        "kind": "boolean"
      }
    },
    {
      "id": "kit-sink",
      "title": "Sink & Faucet",
      "description": "Check for leaks, proper drainage",
      "status": {
        "kind": "boolean"
      }
    },
    {
      "id": "kit-stove",
      "title": "Stove/Oven",
      "description": "Test all burners and oven",
      "status": {
        "kind": "boolean"
      }
    },
    {
      "id": "kit-refrigerator",
      "title": "Refrigerator",
      "description": "Check operation, seals, ice maker",
      "status": {
        "kind": "boolean"
      }
    },
    {
      "id": "kit-dishwasher",
      "title": "Dishwasher",
      "description": "Test operation and check for leaks",
      "status": {
        "kind": "boolean"
      }
    },
    {
      "id": "bath-toilet",
      "title": "Toilet",
      "description": "Check flush operation and seals",
      "status": {
        "kind": "boolean"
      }
    },
    {
      "id": "bath-sink",
      "title": "Sink & Faucet",
      "description": "Check for leaks and drainage",
      "status": {
        "kind": "boolean"
      }
    },
    {
      "id": "bath-tub",
      "title": "Tub/Shower",
      "description": "Check caulking, tiles, drain",
      "status": {
        "kind": "boolean"
      }
    },
    {
      "id": "bath-exhaust",
      "title": "Exhaust Fan",
      "description": "Test operation",
      "status": {
        "kind": "boolean"
      }
    },
    {
      "id": "bath-mirror",
      "title": "Mirror/Medicine Cabinet",
      "description": "Check condition and mounting",
      "status": {
        "kind": "boolean"
      }
    },
    {
      "id": "sys-hvac",
      "title": "HVAC System",
      "description": "Test heating and cooling",
      "status": {
        "kind": "boolean"
      }
    },
    {
      "id": "sys-water-heater",
      "title": "Water Heater",
      "description": "Check operation and condition",
      "status": {
        "kind": "boolean"
      }
    },
    {
      "id": "sys-electrical",
      "title": "Electrical Panel",
      "description": "Check breakers and labeling",
      "status": {
        "kind": "boolean"
      }
    },
    {
      "id": "sys-smoke-detectors",
      "title": "Smoke Detectors",
      "description": "Test all detectors",
      "status": {
        "kind": "boolean"
      }
    },
    {
      "id": "sys-co-detectors",
      "title": "CO Detectors",
      "description": "Test carbon monoxide detectors",
      "status": {
        "kind": "boolean"
      }
    }
  ],
  "layers": {
    "default": {
      "kind": "inline",
      "mimeType": "text/markdown",
      "text": "# PROPERTY INSPECTION CHECKLIST\n\n## EXTERIOR\n\n- [ ] Exterior Walls - Check for cracks, damage, or needed repairs\n- [ ] Windows (exterior) - Check seals, frames, and glass condition\n- [ ] Entry Doors - Check locks, hinges, and weatherstripping\n- [ ] Roof (visible) - Check for missing shingles or visible damage\n- [ ] Gutters & Downspouts - Check for clogs and proper drainage\n- [ ] Landscaping - Lawn, plants, trees condition\n\n## INTERIOR - GENERAL\n\n- [ ] Walls - Check for holes, cracks, stains\n- [ ] Ceilings - Check for water stains, cracks, peeling\n- [ ] Floors - Check flooring condition throughout\n- [ ] Interior Doors - Check operation, locks, handles\n- [ ] Windows (interior) - Check locks, screens, operation\n- [ ] Light Fixtures - Check all fixtures and bulbs\n\n## KITCHEN\n\n- [ ] Cabinets - Check doors, drawers, hinges\n- [ ] Countertops - Check for chips, stains, damage\n- [ ] Sink & Faucet - Check for leaks, proper drainage\n- [ ] Stove/Oven - Test all burners and oven\n- [ ] Refrigerator - Check operation, seals, ice maker\n- [ ] Dishwasher - Test operation and check for leaks\n\n## BATHROOMS\n\n- [ ] Toilet - Check flush operation and seals\n- [ ] Sink & Faucet - Check for leaks and drainage\n- [ ] Tub/Shower - Check caulking, tiles, drain\n- [ ] Exhaust Fan - Test operation\n- [ ] Mirror/Medicine Cabinet - Check condition and mounting\n\n## BUILDING SYSTEMS\n\n- [ ] HVAC System - Test heating and cooling\n- [ ] Water Heater - Check operation and condition\n- [ ] Electrical Panel - Check breakers and labeling\n- [ ] Smoke Detectors - Test all detectors\n- [ ] CO Detectors - Test carbon monoxide detectors\n"
    }
  },
  "defaultLayer": "default"
}